{
  "decision": "pass",
  "key_findings": [
    "第十条规定同一发票最多报销1次,属于第四章禁止性规定",
    "重复出现的同一发票应认定为重复报销风险",
    "本办法自2025-01-01起施行,替代2022版,当前日期2026-07-16在有效期内",
    "未发现后续替代或废止政策,条款现行有效",
    "该条款适用于XX证券所有部门和员工的费用报销事项"
  ],
  "record_ids": [],
  "citations": [
    {"doc_id": "01_expense_reimbursement_2025.md", "clause_no": "第十条"}
  ],
  "unresolved_items": [],
  "artifact_paths": [
    "work/subagents/policy_researcher/policy_applicability.json",
    "work/subagents/policy_researcher/summary.json"
  ]
}
