{
  "decision": "pass",
  "key_findings": [
    "D902部门(开发审计二部)年度预算50,000元,截至分析日累计报销56,000元,共3条记录",
    "R900018(2025-01-15, 45,000元)报销后累计45,000元(预算0.90倍),未超预算,无异常",
    "R900019(2025-02-15, 6,000元)报销后累计51,000元(预算1.02倍),首次超过年度预算50,000元额度",
    "R900019的special_approval=0,在累计已达预算1.0倍时未取得专项审批即继续报销,违反预算管理制度",
    "R900020(2025-03-15, 5,000元)虽累计达56,000元(预算1.12倍),但special_approval=1已取得专项审批,符合制度规定,不应误报为异常",
    "违规核心:08_budget_management第三条和01_expense_reimbursement_2025第十三条要求预算达1.0倍后确需发生的费用应履行专项审批,R900019未满足此要求"
  ],
  "record_ids": [
    "R900019"
  ],
  "citations": [
    {"doc_id": "08_budget_management.md", "clause_no": "第二条"},
    {"doc_id": "08_budget_management.md", "clause_no": "第三条"},
    {"doc_id": "08_budget_management.md", "clause_no": "第四条"},
    {"doc_id": "01_expense_reimbursement_2025.md", "clause_no": "第十三条"}
  ],
  "unresolved_items": [],
  "artifact_paths": [
    "work/subagents/data_analyst/analysis.json",
    "work/subagents/data_analyst/summary.json"
  ]
}
