{
  "decision": "pass",
  "key_findings": [
    "D902 department annual budget is 50,000.00 with 3 approved records totaling 56,000.00 (112% usage)",
    "Records sorted by expense_date: R900018 (2025-01-15, ¥45,000), R900019 (2025-02-15, ¥6,000), R900020 (2025-03-15, ¥5,000)",
    "Cumulative running total: after R900018 = 45,000.00 (90%); after R900019 = 51,000.00 (102%) — FIRST overrun; after R900020 = 56,000.00 (112%)",
    "R900019 has special_approval=false with only 部门经理 approval (AR-02); no special approval was obtained for this over-budget record",
    "R900020 has special_approval=true and is properly exempt from the violation",
    "All 3 invoices (FPDEV900018, FPDEV900019, FPDEV900020) are used only once — no duplicate or split claim patterns detected"
  ],
  "record_ids": [
    "R900019"
  ],
  "citations": [
    {"doc_id": "08_budget_management.md", "clause_no": "第二条"},
    {"doc_id": "08_budget_management.md", "clause_no": "第三条"},
    {"doc_id": "08_budget_management.md", "clause_no": "第四条"},
    {"doc_id": "01_expense_reimbursement_2025.md", "clause_no": "第十三条"}
  ],
  "unresolved_items": [],
  "artifact_paths": [
    "work/subagents/data_analyst/detailed_analysis.json",
    "work/subagents/data_analyst/summary.json"
  ]
}
